{
  "$schema": "http://json-schema.org/draft-07/schema#",
  "$id": "https://aconcaguastonesentinel.com/data/contracts/action_modifiers.schema.json",
  "title": "Action Modifiers",
  "description": "Object keyed by action name. Each value is the modifier set consumed by evaluateOutcome() and updateState() in turn-resolution.js. All numeric fields are optional; missing fields normalize to 0 or safe defaults via getActionModifier().",
  "type": "object",
  "required": ["advance", "advance_slowly", "wait", "descend", "sleep", "shoot_photo"],
  "additionalProperties": false,
  "properties": {
    "advance":        { "$ref": "#/definitions/actionModifier" },
    "advance_slowly": { "$ref": "#/definitions/actionModifier" },
    "wait":           { "$ref": "#/definitions/actionModifier" },
    "descend":        { "$ref": "#/definitions/actionModifier" },
    "sleep":          { "$ref": "#/definitions/actionModifier" },
    "shoot_photo":    { "$ref": "#/definitions/actionModifier" }
  },
  "definitions": {
    "actionModifier": {
      "type": "object",
      "additionalProperties": true,
      "properties": {
        "progress": {
          "type": "number",
          "description": "Additive offset to progressChance. Negative for descend (movement in reverse)."
        },
        "collapse": {
          "type": "number",
          "description": "Additive offset to collapseChance (negative reduces collapse risk)."
        },
        "survival": {
          "type": "number",
          "description": "Additive offset to survivalChance."
        },
        "fatigueMultiplier": {
          "type": "number",
          "minimum": 0,
          "description": "Multiplier applied to fatigueDelta for this action."
        },
        "exposureMultiplier": {
          "type": "number",
          "minimum": 0,
          "description": "Multiplier applied to exposureDelta for this action."
        },
        "timeCost": {
          "type": "integer",
          "minimum": 0,
          "description": "Minutes consumed by this action."
        },
        "fatigueRecovery": { "type": "number", "description": "Positive fatigue recovery applied to state." },
        "exposureRecovery": { "type": "number", "description": "Positive exposure recovery applied to state." },
        "acclimatizationGain": { "type": "number", "minimum": 0 },
        "pressureDeltaCap": { "type": "number", "description": "Caps effectiveDelta for this action (e.g. descend caps at 30)." },
        "riskRelief": { "type": "string", "enum": ["strong", "moderate", "none"] },
        "campOnly": { "type": "boolean", "description": "If true, action is only available at camp nodes." },
        "persistenceReset": { "type": "boolean" },
        "timeReset": { "type": "string", "description": "If set, minutesOfDay resets to this HH:MM time after the action." },
        "photoConfidenceGain": { "type": "number" },
        "photoUncertaintyDrop": { "type": "number" },
        "photoTrendAssist": { "type": "boolean" },
        "photoInsightTurns": { "type": "integer", "minimum": 0 },
        "photoCarryConfidenceGain": { "type": "number" },
        "photoCooldownTurns": { "type": "integer", "minimum": 0 },
        "photoSessionCap": { "type": "integer", "minimum": 0 },
        "fatigueDelta": { "type": "number" },
        "exposureDelta": { "type": "number" },
        "capacityDelta": { "type": "number" }
      }
    }
  }
}
