{
  "advance": {
    "progress": 20,
    "fatigueMultiplier": 1.3,
    "exposureMultiplier": 1.15,
    "timeCost": 120
  },
  "advance_slowly": {
    "progress": 10,
    "fatigueMultiplier": 0.95,
    "exposureMultiplier": 1.0,
    "timeCost": 180
  },
  "wait": {
    "progress": 0,
    "fatigueMultiplier": 0.7,
    "exposureMultiplier": 1.0,
    "acclimatizationGain": 3,
    "timeCost": 60
  },
  "descend": {
    "progress": -20,
    "fatigueMultiplier": 0.8,
    "exposureMultiplier": 0.75,
    "riskRelief": "strong",
    "timeCost": 120
  },
  "sleep": {
    "campOnly": true,
    "persistenceReset": true,
    "fatigueRecovery": 16,
    "exposureRecovery": 8,
    "acclimatizationGain": 6,
    "timeReset": "06:00"
  },
  "shoot_photo": {
    "progress": 0,
    "fatigueMultiplier": 0.85,
    "exposureMultiplier": 0.9,
    "timeCost": 45,
    "photoConfidenceGain": 6,
    "photoUncertaintyDrop": 4,
    "photoTrendAssist": true,
    "photoInsightTurns": 2,
    "photoCarryConfidenceGain": 3,
    "photoCooldownTurns": 2,
    "photoSessionCap": 4
  }
}
